{
    "topic": "elections",
    "source": "Des Moines Register",
    "bias": 1,
    "url": "https://www.desmoinesregister.com/story/news/elections/presidential/caucus/2019/11/08/bernie-sanders-aoc-push-green-new-deal-iowa-rally-council-bluffs/2521316001/",
    "title": "Ocasio-Cortez adds excitement to Sanders rally as campaign claims record crowd",
    "date": "2019-11-08",
    "authors": "Nick Coltrain",
    "content": "CLOSE Basking in loud chants of `` Bernie 's back , '' Democratic presidential candidate Bernie Sanders resumed campaigning weeks after being sidelined by a heart attack and told supporters he was ready to resume `` the epic struggle '' for the White House . AP , AP\nU.S. Sen. Bernie Sanders and U.S. Rep. Alexandria Ocasio-Cortez drew more than 2,000 people to Drake University on Saturday to hear them rail against the climate crisis and the oil companies they blame for it , and promote their `` Green New Deal . ''\nBut first , the audience sat through a slideshow . It was created by a climate scientist , showing graphs and numbers highlighting the loss of the Arctic ice sheet and increasing carbon dioxide levels , and the precarious balance of \u201c spaceship Earth \u2019 s \u201d life support system . It was far from a typical start to a political rally fewer than 90 days from Iowa \u2019 s first-in-the-nation presidential-nominating caucuses .\nThe big cheers and applause came later in the Des Moines event . Ocasio-Cortez \u2019 s entrance was greeted by a sea of cellphones popping out to take photos and videos \u2014 evidence of the enthusiasm her political celebrity brought to the swing . She greeted the crowd in turn by asking who was ready for a `` Green New Deal . ''\nSaturday \u2019 s \u201c Climate Crisis Summit , \u201d a centerpiece of Sanders \u2019 swing with the New York congresswoman , wasn \u2019 t a traditional campaign rally . Before the politicians ' keynote speeches , a panel of local and national activists spoke about problems and solutions for climate change . Sanders \u2019 campaign announced last week that it was refocusing its Iowa effort around climate change . It branded its events with Ocasio-Cortez around the \u201c Green New Deal . \u201d\nOcasio-Cortez is a lead sponsor of the \u201c Green New Deal , \u201d a comprehensive bill to remake the economy around fighting climate change . Sanders has adopted a similar proposal in his campaign \u2014 an estimated $ 16.3 trillion effort that would create 20 million jobs , lead to a 100 % renewable-energy-powered electric system and a 100 % electric transportation system by 2030 , according to the campaign . It would also remake much of the agricultural industry toward small farms and away from large agribusiness operations .\n`` When it comes to a Green New Deal , it 's always , always a question of how we 're going to pay for it , \u201d Ocasio-Cortez said , being drowned out by a standing ovation . \u201c \u2026 As if we 're not paying for it right now , with half the Midwest under water , as if Hurricane Katrina and Maria did n't happen , as if sea levels were n't rising , as if California was n't on fire . How do we pay for that ? ''\nOcasio-Cortez was a key reason Wes Wierson , a genome scientist , attended the summit Saturday , he said . He \u2019 s heard her in 30-second snippets on the news but wanted to hear her in person and at length . But the focus on climate was itself noteworthy , he said .\n\u201c Without the planet , none of the other issues really matter , \u201d he said .\nThat echoed a sentiment made by Sanders himself . In his speech , Sanders noted that his \u201c Green New Deal \u201d has a hefty price tag , \u201c but I want you to tell me what the alternative is to saving the planet . \u201d\n`` I wish from the bottom of my heart , I really do , that I could tell you we do n't need aggressive unprecedented action , \u201d Sanders said . \u201c ... but if I told you that , I 'd be lying to you , and I 'd be betraying my kids , my seven grandchildren , and future generations . \u201d\nIowa has faced climate-change-induced harm already , Sanders argued . Historic precipitation caused billions of dollars in damage through floods , topsoil loss and more .\nThe activists who spoke framed Sanders \u2019 proposal as the most ambitious policy to avert a climate crisis . It featured a national leader with the Sunrise Movement , a direct-action protest movement that \u2019 s taken credit for pushing all the candidates for the Democratic presidential nomination to adopt a climate plan and CNN to host a seven-hour series of town hall events earlier in the race . Sanders also credited the group 's efforts from the lectern .\nThe Sunrise Movement has also taken shots at other candidates , notably former Vice President Joe Biden . A week before Sanders \u2019 climate summit , about 10 Sunrise Movement protesters interrupted Biden at a Des Moines campaign office opening and unfurled a black and gold banner reading \u201c BIDEN BOUGHT OUT BY BIG OIL . \u201d\nThe protesters also filmed a video at September \u2019 s Polk County Steak Fry where an activist urges him to embrace the `` Green New Deal '' and accuses him of breaking a pledge not to accept money from fossil fuel executives .\nOn Friday in Council Bluffs , Ocasio-Cortez helped the Sanders campaign claim a record 2020 turnout for an Iowa event . More than 2,400 people filled an Iowa Western Community College arena to hear the two .\nThe crowd in Council Bluffs was estimated at about 100 more than the figure cited by South Bend , Indiana , Mayor Pete Buttigieg \u2019 s campaign for his audience a week earlier at the Iowa Democratic Party \u2019 s Liberty and Justice Dinner . Both audiences could have included many non-Iowans \u2014 the dinner draws supporters from all over the country , and Council Bluffs is just across the Missouri River from Omaha , Nebraska .\n\u201c We need to stitch this movement together , bit by bit , stitch by stitch , and that \u2019 s how we \u2019 re going to win , \u201d Ocasio-Cortez told the crowd Friday , following a call to \u201c stitch together \u201d a cross-class and cross-demographic coalition . \u201c \u2026 That \u2019 s not just how we \u2019 re going to win a Bernie Sanders presidency , but that \u2019 s how we \u2019 re going to win our future back . That \u2019 s how we \u2019 re going to win our country back . That \u2019 s how we \u2019 re going to win it all . \u201d\n\u201c I love her , \u201d Hannah Cook , a 20-year-old student from nearby Glenwood , Iowa , said after the event , slumping her shoulders and rolling her eyes up for emphasis . \u201c I was so excited when I saw that ( Ocasio-Cortez was going to be here ) . \u201d\nCook and her friend Kelsey Pavelka said they both probably would have come out regardless of Ocasio-Cortez 's presence . But the freshman congresswoman , and youngest woman ever elected to the U.S. Congress , brought a new energy , they said .\nThis story has been updated to include information from Saturday 's event .",
    "content_original": "CLOSE Basking in loud chants of \"Bernie's back,\" Democratic presidential candidate Bernie Sanders resumed campaigning weeks after being sidelined by a heart attack and told supporters he was ready to resume \"the epic struggle\" for the White House. AP, AP\n\nU.S. Sen. Bernie Sanders and U.S. Rep. Alexandria Ocasio-Cortez drew more than 2,000 people to Drake University on Saturday to hear them rail against the climate crisis and the oil companies they blame for it, and promote their \"Green New Deal.\"\n\nBut first, the audience sat through a slideshow. It was created by a climate scientist, showing graphs and numbers highlighting the loss of the Arctic ice sheet and increasing carbon dioxide levels, and the precarious balance of \u201cspaceship Earth\u2019s\u201d life support system. It was far from a typical start to a political rally fewer than 90 days from Iowa\u2019s first-in-the-nation presidential-nominating caucuses.\n\nThe big cheers and applause came later in the Des Moines event. Ocasio-Cortez\u2019s entrance was greeted by a sea of cellphones popping out to take photos and videos \u2014 evidence of the enthusiasm her political celebrity brought to the swing. She greeted the crowd in turn by asking who was ready for a \"Green New Deal.\"\n\nSaturday\u2019s \u201cClimate Crisis Summit,\u201d a centerpiece of Sanders\u2019 swing with the New York congresswoman, wasn\u2019t a traditional campaign rally. Before the politicians' keynote speeches, a panel of local and national activists spoke about problems and solutions for climate change. Sanders\u2019 campaign announced last week that it was refocusing its Iowa effort around climate change. It branded its events with Ocasio-Cortez around the \u201cGreen New Deal.\u201d\n\nBuy Photo United States Representative Alexandria Ocasio-Cortez (D-NY) speaks on Saturday, Nov. 9, 2019, at Drake University in Des Moines. (Photo: Bryon Houlgrave/The Register)\n\nOcasio-Cortez is a lead sponsor of the \u201cGreen New Deal,\u201d a comprehensive bill to remake the economy around fighting climate change. Sanders has adopted a similar proposal in his campaign \u2014 an estimated $16.3 trillion effort that would create 20 million jobs, lead to a 100% renewable-energy-powered electric system and a 100% electric transportation system by 2030, according to the campaign. It would also remake much of the agricultural industry toward small farms and away from large agribusiness operations.\n\n\"When it comes to a Green New Deal, it's always, always a question of how we're going to pay for it,\u201d Ocasio-Cortez said, being drowned out by a standing ovation. \u201c\u2026 As if we're not paying for it right now, with half the Midwest under water, as if Hurricane Katrina and Maria didn't happen, as if sea levels weren't rising, as if California wasn't on fire. How do we pay for that?\"\n\nOcasio-Cortez was a key reason Wes Wierson, a genome scientist, attended the summit Saturday, he said. He\u2019s heard her in 30-second snippets on the news but wanted to hear her in person and at length. But the focus on climate was itself noteworthy, he said.\n\n\u201cWithout the planet, none of the other issues really matter,\u201d he said.\n\nThat echoed a sentiment made by Sanders himself. In his speech, Sanders noted that his \u201cGreen New Deal\u201d has a hefty price tag, \u201cbut I want you to tell me what the alternative is to saving the planet.\u201d\n\n\"I wish from the bottom of my heart, I really do, that I could tell you we don't need aggressive unprecedented action,\u201d Sanders said. \u201c... but if I told you that, I'd be lying to you, and I'd be betraying my kids, my seven grandchildren, and future generations.\u201d\n\nIowa has faced climate-change-induced harm already, Sanders argued. Historic precipitation caused billions of dollars in damage through floods, topsoil loss and more.\n\nThe activists who spoke framed Sanders\u2019 proposal as the most ambitious policy to avert a climate crisis. It featured a national leader with the Sunrise Movement, a direct-action protest movement that\u2019s taken credit for pushing all the candidates for the Democratic presidential nomination to adopt a climate plan and CNN to host a seven-hour series of town hall events earlier in the race. Sanders also credited the group's efforts from the lectern.\n\nThe Sunrise Movement has also taken shots at other candidates, notably former Vice President Joe Biden. A week before Sanders\u2019 climate summit, about 10 Sunrise Movement protesters interrupted Biden at a Des Moines campaign office opening and unfurled a black and gold banner reading \u201cBIDEN BOUGHT OUT BY BIG OIL.\u201d\n\nThe protesters also filmed a video at September\u2019s Polk County Steak Fry where an activist urges him to embrace the \"Green New Deal\" and accuses him of breaking a pledge not to accept money from fossil fuel executives.\n\nBuy Photo U.S. Sen. Bernie Sanders addresses a crowd in Council Bluffs, Ia., on Friday, Nov. 8, 2019, after being introduced by U.S. Rep. Alexandria Ocasio-Cortez (Photo: Nick Coltrain/Des Moines Register)\n\nOn Friday in Council Bluffs, Ocasio-Cortez helped the Sanders campaign claim a record 2020 turnout for an Iowa event. More than 2,400 people filled an Iowa Western Community College arena to hear the two.\n\nThe crowd in Council Bluffs was estimated at about 100 more than the figure cited by South Bend, Indiana, Mayor Pete Buttigieg\u2019s campaign for his audience a week earlier at the Iowa Democratic Party\u2019s Liberty and Justice Dinner. Both audiences could have included many non-Iowans \u2014 the dinner draws supporters from all over the country, and Council Bluffs is just across the Missouri River from Omaha, Nebraska.\n\n\u201cWe need to stitch this movement together, bit by bit, stitch by stitch, and that\u2019s how we\u2019re going to win,\u201d Ocasio-Cortez told the crowd Friday, following a call to \u201cstitch together\u201d a cross-class and cross-demographic coalition. \u201c\u2026 That\u2019s not just how we\u2019re going to win a Bernie Sanders presidency, but that\u2019s how we\u2019re going to win our future back. That\u2019s how we\u2019re going to win our country back. That\u2019s how we\u2019re going to win it all.\u201d\n\n\u201cI love her,\u201d Hannah Cook, a 20-year-old student from nearby Glenwood, Iowa, said after the event, slumping her shoulders and rolling her eyes up for emphasis. \u201cI was so excited when I saw that (Ocasio-Cortez was going to be here).\u201d\n\nCook and her friend Kelsey Pavelka said they both probably would have come out regardless of Ocasio-Cortez's presence. But the freshman congresswoman, and youngest woman ever elected to the U.S. Congress, brought a new energy, they said.\n\nThis story has been updated to include information from Saturday's event.\n\nNick Coltrain is a politics and data reporter for the Register. Reach him at ncoltrain@registermedia.com or at 515-284-8361. Reporter Stephen Gruber-Miller contributed to this report.\n\nRead or Share this story: https://www.desmoinesregister.com/story/news/elections/presidential/caucus/2019/11/08/bernie-sanders-aoc-push-green-new-deal-iowa-rally-council-bluffs/2521316001/",
    "source_url": "www.desmoinesregister.com",
    "bias_text": "center",
    "ID": "Dp5CzNCWZEaUGvrv"
}