{
    "topic": "elections",
    "source": "USA TODAY",
    "bias": 1,
    "url": "https://www.usatoday.com/story/news/politics/elections/2019/03/10/black-womens-groups-leverage-their-clout-2020-elections/3101381002/",
    "title": "Black women's groups demanding 'a return on our voting investment' for 2020 presidential elections",
    "date": "2019-03-10",
    "authors": "Deborah Barfield Berry",
    "content": "CLOSE Melanie Campbell of the Black Women 's Roundtable thinks it is time for this voting bloc to get the respect it deserves . \u2588\u2588\u2588\nWASHINGTON \u2013 After historic midterms , when they helped Democrats recapture the House of Representatives , women of color are moving fast to leverage their newfound political clout for the 2020 presidential election .\nThey 're hosting a presidential forum \u2013 in a bold move to get national candidates to recognize their influence \u2013 while ramping up get-out-the-vote efforts and preparing more women to run for Congress .\n\u201c There \u2019 s never been a moment for women of color in politics like there is now , '' said Aimee Allison , president and founder of She the People , a national network . `` It \u2019 s kind of like there \u2019 s a big awakening . \u201d\nAfter years of complaining that national political parties have not done enough to fund their turnout efforts or to support black female candidates , some groups are raising the money to do it themselves .\n\u201c We are demanding a return on our voting investment , '' said Glynda Carr , co-founder of Higher Heights , which supports black female candidates and more black political involvement .\n\u201c We have seen women step up in the entire political ecosystem . It \u2019 s not only running for office . We see women step up and running campaigns , being the press secretaries , being the finance director , '' said A \u2019 shanti F. Gholar , political director at Emerge America , which trains Democratic female candidates . \u201c We have also seen women start several organizations that support candidates , which is extremely important because we know not every woman is going to want to run for office .\nTo take advantage of the national attention , She the People will host a presidential forum in Houston in April \u2013 the first by a group led by women of color .\n`` I \u2019 m excited and also recognize how much is riding on the success of this , '' said Allison , who plans to announce participating candidates as soon as this week .\nWhether candidates attend could show how important it is to court women of color .\nOrganizers said they scheduled the forum early in the campaign cycle to establish the group as a political force . Holding it in a red state was also intentional .\nThe South and the Southwest , which have diverse populations , will be fertile ground for Democratic candidates .\n\u201c For men and women ( candidates ) of various races , they all need to win women of color , '' Allison said . `` They have to make their case . \u201d\nThe group plans to hold a town hall this spring in Virginia to focus on state races . Virginia is a crucial state for Democratic presidential candidates .\nVirginia was in the national spotlight this year when a photo emerged of a person in blackface and another wearing a Ku Klux Klan robe on the yearbook page of Democratic Gov . Ralph Northam . Northam initially apologized but later questioned whether he was in the picture .\n\u201c It \u2019 s very important for women of color to be heard given the political environment that \u2019 s going on there , '' Allison said . \u201c We had no idea that Virginia was going to be Crazytown . \u201d\nThe presidential forum and other events hosted by women of color are part of a movement across the country , said Debbie Walsh , director of the Center for American Women and Politics at Rutgers University .\n\u201c There \u2019 s an energy in communities of women of color to do everything possible to have a greater voice and to make sure they are not taken for granted , \u201d Walsh said .\nOne early indicator of that power will be who shows up for the presidential forum , Walsh said .\n\u201c Democratic presidential hopefuls who ignore the power of the votes of women of color do so at their own peril , \u201d she said .\nSisters Lead Sisters Vote , a group formed last spring , plans to partner with She the People for the presidential forum . The group plans listening sessions with black female leaders to discuss get-out-the-vote campaigns and demands from candidates .\n`` We \u2019 re not going to just be voting for people just to be voting for people , '' said Holli Holliday , president of Sisters Lead Sisters Vote . `` We \u2019 re going to try to let folks know where people stand for real and not just rubber-stamping people . \u201d\nThis week , the Black Women \u2019 s Roundtable will hold a summit in Washington , in part to discuss its strategy for the 2020 presidential election .\nThe group will send questionnaires to presidential candidates and follow up with meetings with their campaigns .\n\u201c We decided we need something in writing , so we would have something to leverage once people are elected , \u201d said Melanie Campbell , convener of the roundtable .\n\u201c We \u2019 re not waiting on anybody to acknowledge us , \u201d she said .\nBefore he opted not to run for president , Sen. Sherrod Brown , D-Ohio , tweeted , \u201c You ca n't be a human being who 's awake and not understand that black women are the heart of the Democratic Party . \u201d\nBlack women , who trend Democratic , have long been active in their communities , playing key roles in the civil rights movement and helping to get neighbors , family and fellow church members to the polls .\nBlack female voters helped Doug Jones pull off an upset in Alabama in 2017 , making him the state \u2019 s first Democratic senator in 25 years .\nThey helped Democratic gubernatorial candidates Stacey Abrams in Georgia and Andrew Gillum in Florida come close to victory last year .\nThe groups backed female candidates of color who made this Congress the most diverse in history .\nWomen of color are likely to play a crucial role in the presidential primaries , particularly when the focus shifts to South Carolina \u2013 the first early primary state with a diverse population .\n\u201c Southern states really make a big difference in whoever wants to win , \u201d Campbell said .\nCampbell criticized Republicans and Democrats for not talking with black women enough .\n`` When it comes to engaging and being respectful of the black vote and black women \u2019 s vote , they have a lot of room ( where ) they can go up , '' she said of Republicans .\nShe cited a survey by her organization that found only 1 percent of black women say Republicans have their best interest at heart .\nDemocrats did n't fare well either . Campbell said that in 2017 , there was an 11-percentage-pointdrop in black women \u2019 s faith in the party .\n\u201c We \u2019 re looking for people to respect our vote , respect our leadership , '' she said . `` Don \u2019 t just think that we \u2019 re just a voting bloc . ''\nBlack women \u2019 s groups and others plan to continue urging more women of color to run for office , including for Congress .\nIn Louisiana , nearly two dozen women signed up for Emerge Louisiana 's training program for Democratic candidates this year .\nThey included women running for school boards , the state Senate and Congress .\nSandra \u201c Candy \u201d Christophe of Alexandria , Louisiana , joined Emerge 's boot camp . She hopes to represent the 5th Congressional District , succeeding GOP incumbent Rep. Ralph Abraham , who is running for governor .\nIf she wins , Christophe , who is black , would be the only woman in the Louisiana delegation .\n\u201c I don \u2019 t know if Louisiana is ready for it , but I am inspired and encouraged by those women who have run , '' Christophe said .",
    "content_original": "CLOSE Melanie Campbell of the Black Women's Roundtable thinks it is time for this voting bloc to get the respect it deserves. USA TODAY\n\nWASHINGTON \u2013 After historic midterms, when they helped Democrats recapture the House of Representatives, women of color are moving fast to leverage their newfound political clout for the 2020 presidential election.\n\nThey're hosting a presidential forum \u2013 in a bold move to get national candidates to recognize their influence \u2013 while ramping up get-out-the-vote efforts and preparing more women to run for Congress.\n\n\u201cThere\u2019s never been a moment for women of color in politics like there is now,'' said Aimee Allison, president and founder of She the People, a national network. \"It\u2019s kind of like there\u2019s a big awakening.\u201d\n\nAfter years of complaining that national political parties have not done enough to fund their turnout efforts or to support black female candidates, some groups are raising the money to do it themselves.\n\n\u201cWe are demanding a return on our voting investment,\" said Glynda Carr, co-founder of Higher Heights, which supports black female candidates and more black political involvement.\n\nThat has paid off.\n\n\u201cWe have seen women step up in the entire political ecosystem. It\u2019s not only running for office. We see women step up and running campaigns, being the press secretaries, being the finance director,\" said A\u2019shanti F. Gholar, political director at Emerge America, which trains Democratic female candidates. \u201cWe have also seen women start several organizations that support candidates, which is extremely important because we know not every woman is going to want to run for office.\n\n\u201cAll of those things are finally coming together.\"\n\nWomen attending the Black Women's Roundtable summit March 14, 2018, head to Senate offices in Washington to discuss issues that affect communities of color. (Photo: Deborah Barfield Berry, USA TODAY)\n\nTurning to the national stage\n\nTo take advantage of the national attention, She the People will host a presidential forum in Houston in April \u2013 the first by a group led by women of color.\n\n\"I\u2019m excited and also recognize how much is riding on the success of this,'' said Allison, who plans to announce participating candidates as soon as this week.\n\nWhether candidates attend could show how important it is to court women of color.\n\nOrganizers said they scheduled the forum early in the campaign cycle to establish the group as a political force. Holding it in a red state was also intentional.\n\nThe South and the Southwest, which have diverse populations, will be fertile ground for Democratic candidates.\n\n\u201cFor men and women (candidates) of various races, they all need to win women of color,'' Allison said. \"They have to make their case.\u201d\n\nThe group plans to hold a town hall this spring in Virginia to focus on state races. Virginia is a crucial state for Democratic presidential candidates.\n\nMelanie Campbell, president of the National Coalition on Black Civil Participation, and other women attending the Black Women's Roundtable conference March 14, 2018, talk to reporters outside the U.S. Capitol. (Photo: Deborah Barfield Berry, USA TODAY)\n\nVirginia was in the national spotlight this year when a photo emerged of a person in blackface and another wearing a Ku Klux Klan robe on the yearbook page of Democratic Gov. Ralph Northam. Northam initially apologized but later questioned whether he was in the picture.\n\n\u201cIt\u2019s very important for women of color to be heard given the political environment that\u2019s going on there,\" Allison said. \u201cWe had no idea that Virginia was going to be Crazytown.\u201d\n\nThe presidential forum and other events hosted by women of color are part of a movement across the country, said Debbie Walsh, director of the Center for American Women and Politics at Rutgers University.\n\n\u201cThere\u2019s an energy in communities of women of color to do everything possible to have a greater voice and to make sure they are not taken for granted,\u201d Walsh said.\n\nOne early indicator of that power will be who shows up for the presidential forum, Walsh said.\n\n\u201cDemocratic presidential hopefuls who ignore the power of the votes of women of color do so at their own peril,\u201d she said.\n\nHolli Holliday, president of Sisters Lead Sisters Vote, said her organization will host listening sessions starting in May for leaders of black women's groups. (Photo: Deborah Barfield Berry, USA TODAY)\n\nOther groups demand an ear\n\nSisters Lead Sisters Vote, a group formed last spring, plans to partner with She the People for the presidential forum. The group plans listening sessions with black female leaders to discuss get-out-the-vote campaigns and demands from candidates.\n\n\"We\u2019re not going to just be voting for people just to be voting for people,\" said Holli Holliday, president of Sisters Lead Sisters Vote. \"We\u2019re going to try to let folks know where people stand for real and not just rubber-stamping people.\u201d\n\nThis week, the Black Women\u2019s Roundtable will hold a summit in Washington, in part to discuss its strategy for the 2020 presidential election.\n\nThe group will send questionnaires to presidential candidates and follow up with meetings with their campaigns.\n\n\u201cWe decided we need something in writing, so we would have something to leverage once people are elected,\u201d said Melanie Campbell, convener of the roundtable.\n\nCampbell said her organization hasn\u2019t heard from presidential candidates.\n\n\u201cWe\u2019re not waiting on anybody to acknowledge us,\u201d she said.\n\nBefore he opted not to run for president, Sen. Sherrod Brown, D-Ohio, tweeted, \u201cYou can't be a human being who's awake and not understand that black women are the heart of the Democratic Party.\u201d\n\nSen. Doug Jones, D-Ala., talked to Sheila Tyson, a Birmingham city councilwoman, and other women attending the Black Women's Roundtable conference March 14, 2018. Black women helped Jones win his 2017 special election. (Photo: Deborah Barfield Berry, USA TODAY)\n\nBlack women key to Democratic wins\n\nBlack women, who trend Democratic, have long been active in their communities, playing key roles in the civil rights movement and helping to get neighbors, family and fellow church members to the polls.\n\nBlack female voters helped Doug Jones pull off an upset in Alabama in 2017, making him the state\u2019s first Democratic senator in 25 years.\n\nThey helped Democratic gubernatorial candidates Stacey Abrams in Georgia and Andrew Gillum in Florida come close to victory last year.\n\nThe groups backed female candidates of color who made this Congress the most diverse in history.\n\nWomen of color are likely to play a crucial role in the presidential primaries, particularly when the focus shifts to South Carolina \u2013 the first early primary state with a diverse population.\n\nBlack voters are concentrated in the South.\n\n\u201cSouthern states really make a big difference in whoever wants to win,\u201d Campbell said.\n\nDemocrat Stacey Abrams delivers her party\u2019s response to President Donald Trump\u2019s State of the Union address. (Photo: John Amis, AP Images)\n\nCampbell criticized Republicans and Democrats for not talking with black women enough.\n\n\"When it comes to engaging and being respectful of the black vote and black women\u2019s vote, they have a lot of room (where) they can go up,\" she said of Republicans.\n\nShe cited a survey by her organization that found only 1 percent of black women say Republicans have their best interest at heart.\n\nDemocrats didn't fare well either. Campbell said that in 2017, there was an 11-percentage-pointdrop in black women\u2019s faith in the party.\n\n\u201cWe\u2019re looking for people to respect our vote, respect our leadership,\" she said. \"Don\u2019t just think that we\u2019re just a voting bloc.\"\n\nPush for women to run for Congress\n\nBlack women\u2019s groups and others plan to continue urging more women of color to run for office, including for Congress.\n\nIn Louisiana, nearly two dozen women signed up for Emerge Louisiana's training program for Democratic candidates this year.\n\nThey included women running for school boards, the state Senate and Congress.\n\nSandra \u201cCandy\u201d Christophe of Alexandria, Louisiana, joined Emerge's boot camp. She hopes to represent the 5th Congressional District, succeeding GOP incumbent Rep. Ralph Abraham, who is running for governor.\n\nIf she wins, Christophe, who is black, would be the only woman in the Louisiana delegation.\n\n\u201cI don\u2019t know if Louisiana is ready for it, but I am inspired and encouraged by those women who have run,\" Christophe said.\n\nRead or Share this story: https://www.usatoday.com/story/news/politics/elections/2019/03/10/black-womens-groups-leverage-their-clout-2020-elections/3101381002/",
    "source_url": "www.usatoday.com",
    "bias_text": "center",
    "ID": "qp9lpqO85N0f91vQ"
}