{
    "topic": "immigration",
    "source": "USA TODAY",
    "bias": 1,
    "url": "https://www.usatoday.com/story/news/2019/02/11/trump-el-paso-rally/2834896002/",
    "title": "El Paso braces for Trump rally, as another border community deflects images of unsafe city",
    "date": "2019-02-11",
    "authors": "Rick Jervis",
    "content": "EL PASO \u2013 Lyda Ness-Garcia listened with stunned dismay last week as President Donald Trump said her hometown was \u201c once considered one of our nation 's most dangerous cities , \u201d then announced a campaign rally here to draw support for his border wall and re-election next year .\nOn Monday , she and other activists will lead protestors in a counter rally to the president \u2019 s gathering that will include former congressman Beto O \u2019 Rourke , local leaders , taco trucks and teams of mariachisplaying Bob Marley \u2019 s \u201c Get Up , Stand Up . \u201d\nTheir message : El Paso is safe , vibrant and open for business .\n\u201c People are so eager to believe the worst of us in border towns , '' said Ness-Garcia , a family law attorney and founder of Women \u2019 s March El Paso . \u201c We are proud El Pasoans . We will show America and the world who we really are . \u201d\nOnce again , a border community along the Texas-Mexico border finds itself at the center of a divisive national debate over immigration and border security \u2013 and defending itself from perceptions of rampant criminality .\nLast month , Trump traveled to McAllen , 800 miles southeast on the Texas border , to meet with officials from U.S. Customs and Border Protection amidst a government shutdown that centered on his demands for $ 5.7 billion to build a border wall . McAllen residents were quick to remind the world they live in a safe community with a relatively low violent crime rate , prompting one theater owner to display on his theater \u2019 s marquee : `` WELCOME TO MCALLEN , 7TH SAFEST CITY IN AMERICA . ''\nOn Monday , the president will speak in front of several thousand supporters at the El Paso County Coliseum , located a short stroll from the U.S.-Mexico border . As in his McAllen 's visit , Trump \u2019 s trip to El Paso will be rife with political undertones : It \u2019 s a campaign event in a strongly Democratic county , the hometown of O \u2019 Rourke \u2013 considered a potential challenger to Trump in 2020 \u2013 and just four days before another partial government shutdown could begin .\nA bipartisan group of lawmakers were negotiating ahead of Friday \u2019 s deadline , but on Sunday , those talks appeared to stall , setting up another face-off over funding .\nMany here seethed at Trump \u2019 s characterization of El Paso during his State of the Union address last week , when he said the border city had \u201c extremely high rates of violent crime \u201d until a border fence was installed . The peak of violent crime in El Paso \u2013 at about 6,500 violent crimes per year \u2013 was recorded in 1993 , well before the fence was erected in 2008 , and has fallen steadily since , according to an analysis by the El Paso Times .\nBut even at its violent peak , El Paso recorded lower levels of violent crime than comparably-sized cities , such as the 22,000 violent crimes reported by the Baltimore City Police Department and 16,600 reported by police in Washington , D.C. , the same year , according to the Times .\nThe president \u2019 s remarks felt like another dagger aimed at border communities who have lived in harmony with their Mexican neighbors for generations , said state Sen. Jos\u00e9 Rodriguez , whose district represents El Paso .\nBesides the misleading perception that danger lurks in El Paso at the hands of immigrants , such comments erode trust built up over the years between local law enforcement and immigrant communities , said Rodriguez , who spent 20 years as the county \u2019 s top prosecutor .\nThat cooperation helped law enforcement break up migrant smuggling rings , drive out gangs and significantly lower crime , he said .\n\u201c What I fear is that , with the kinds of statements Trump makes , people will conflate violence with Mexico , \u201d Rodriguez said . \u201c El Paso is a very safe community . It \u2019 s just simply outrageous people like President Trump will depict us as living in a dangerous area . \u201d\nFalling crime stats aside , El Paso is struggling with a growing immigration crisis . The number of immigrant families apprehended by the Border Patrol \u2019 s El Paso Sector has soared in recent years , from 562 in fiscal year 2014 to 8,609 in fiscal year 2017 and 12,312 last fiscal year . Over Christmas , hundreds of immigrants released from federal immigration custody were dropped off at downtown bus shelters , sending churches and activist groups scrambling to assist them .\nAdolpho Telles , chairman of El Paso County Republican Party , said he feels the area has become safer since federal authorities erected the border fence in El Paso , limiting the streams of migrants who were crossing into the community .\nShortly after Trump \u2019 s State of the Union , Telles received a request from the president \u2019 s campaign for 150 volunteers to help at the rally , which he secured within two days , he said .\nIn McAllen last month , more than 100 Trump supporters lined a busy street near the airport in a well-organized rally to welcome the president . Telles said he does n't expect a similar pro-Trump rally to materialize in El Paso , but he hoped both sides of the divisive debate could respect the other on Monday .\n\u201c I hope El Paso gives the president an extremely El Paso-friendly welcome , \u201d he said . \u201c I hope the president spends more time talking about unity in the nation and I hope we as a city could show that unity . \u201d\nSilvestre Reyes , a former Border Patrol sector chief here and ex-Congressman representing El Paso , said he was taken aback by the inaccuracy of Trump 's recent comments . Illegal crossings into El Paso dropped from around 10,000 a day to less than 200 after he launched Operation Hold the Line -- more than a decade before the security fence went up .\nHe said he found Trump 's comments -- followed by his decision to hold a campaign rally here -- distasteful .\n`` \u202aIt \u2019 s very frustrating to have someone at that level who could misrepresent what actually goes on '' Reyes said .\nNess-Garcia , the march organizer , said she and others are dismayed that El Paso has been the site for controversial federal immigration practices . The Trump administration launched a pilot program here for family separations before expanding the program , she said . The policy drew fierce criticism and was ultimately dropped , though it remains unclear how many children were separated from the families and are still being separated .\nAnd the Tornillo faciltiy , a tent city housing migrant youth that also later closed under withering criticism , was operated nearby .\n`` El Paso , unfortunately , has been the testing grounds for some of the most inhumane policies of this administration , '' Ness-Garcia said . `` Yes , there 's a lot of anger , but there 's allo a lot of positivity . That 's what we want to focus on : being peaceful and passionate . ''\nPerception is important in a place like El Paso , the nation 's 10th largest exporter and whose retail stores rely heavily on shoppers crossing over from Mexico .\nLocal leaders are continuously fighting negative portrayals of El Paso , not just arising from Washington but from Hollywood , as well , said Jon Barela , chief executive of the Borderplex Alliance , an El-Paso-based economic development group .\nMovies , like Oscar-nominated `` Sicario , '' have portrayed El Paso as struggling to rebuff the carnage spilling over from cartel violence across the border in Ciudad Juarez , Mexico .\n\u201c That \u2019 s the image we have to fight every single day , and it \u2019 s a false image of our area , '' Barela said .\nAt Lucy \u2019 s Coffee Shop near downtown El Paso , diners munched on breakfast burritos and debated which of the two rallies they \u2019 d rather attend : Trump \u2019 s or O \u2019 Rourke \u2019 s .\nJessica Kludt , 34 , an attorney , said she was definitely going to the latter .\n\u201c I \u2019 m hoping the Beto rally will be full and the Trump rally is empty , \u201d she said . \u201c That \u2019 s my hope . \u201d",
    "content_original": "EL PASO \u2013 Lyda Ness-Garcia listened with stunned dismay last week as President Donald Trump said her hometown was \u201conce considered one of our nation's most dangerous cities,\u201d then announced a campaign rally here to draw support for his border wall and re-election next year.\n\nOn Monday, she and other activists will lead protestors in a counter rally to the president\u2019s gathering that will include former congressman Beto O\u2019Rourke, local leaders, taco trucks and teams of mariachisplaying Bob Marley\u2019s \u201cGet Up, Stand Up.\u201d\n\nTheir message: El Paso is safe, vibrant and open for business.\n\n\u201cPeople are so eager to believe the worst of us in border towns,\" said Ness-Garcia, a family law attorney and founder of Women\u2019s March El Paso. \u201cWe are proud El Pasoans. We will show America and the world who we really are.\u201d\n\nOnce again, a border community along the Texas-Mexico border finds itself at the center of a divisive national debate over immigration and border security \u2013 and defending itself from perceptions of rampant criminality.\n\nCentral American immigrants walk along the border fence after crossing the Rio Grande from Mexico on February 01, 2019 in El Paso, Texas. The migrants turned themselves in to U.S. Border Patrol agents, seeking political asylum. (Photo: John Moore/Getty Images)\n\nLast month, Trump traveled to McAllen, 800 miles southeast on the Texas border, to meet with officials from U.S. Customs and Border Protection amidst a government shutdown that centered on his demands for $5.7 billion to build a border wall. McAllen residents were quick to remind the world they live in a safe community with a relatively low violent crime rate, prompting one theater owner to display on his theater\u2019s marquee: \"WELCOME TO MCALLEN, 7TH SAFEST CITY IN AMERICA.\"\n\nOn Monday, the president will speak in front of several thousand supporters at the El Paso County Coliseum, located a short stroll from the U.S.-Mexico border. As in his McAllen's visit, Trump\u2019s trip to El Paso will be rife with political undertones: It\u2019s a campaign event in a strongly Democratic county, the hometown of O\u2019Rourke \u2013 considered a potential challenger to Trump in 2020 \u2013 and just four days before another partial government shutdown could begin.\n\nA bipartisan group of lawmakers were negotiating ahead of Friday\u2019s deadline, but on Sunday, those talks appeared to stall , setting up another face-off over funding.\n\nMany here seethed at Trump\u2019s characterization of El Paso during his State of the Union address last week, when he said the border city had \u201cextremely high rates of violent crime\u201d until a border fence was installed. The peak of violent crime in El Paso \u2013 at about 6,500 violent crimes per year \u2013 was recorded in 1993, well before the fence was erected in 2008, and has fallen steadily since, according to an analysis by the El Paso Times.\n\nBut even at its violent peak, El Paso recorded lower levels of violent crime than comparably-sized cities, such as the 22,000 violent crimes reported by the Baltimore City Police Department and 16,600 reported by police in Washington, D.C., the same year, according to the Times.\n\nThe president\u2019s remarks felt like another dagger aimed at border communities who have lived in harmony with their Mexican neighbors for generations, said state Sen. Jos\u00e9 Rodriguez, whose district represents El Paso.\n\nBesides the misleading perception that danger lurks in El Paso at the hands of immigrants, such comments erode trust built up over the years between local law enforcement and immigrant communities, said Rodriguez, who spent 20 years as the county\u2019s top prosecutor.\n\nAs they braced for his rally in El Paso, people here remember President Donald Trump's visit to McAllen, Texas, last month. During that visit, the marquee at the Cine El Rey, a 1940s-era theater-turned-music-venue, touted the fact that McAllen is ranked as one of the safest cities in the country. (Photo: Rick Jervis, USA TODAY)\n\nThat cooperation helped law enforcement break up migrant smuggling rings, drive out gangs and significantly lower crime, he said.\n\n\u201cWhat I fear is that, with the kinds of statements Trump makes, people will conflate violence with Mexico,\u201d Rodriguez said. \u201cEl Paso is a very safe community. It\u2019s just simply outrageous people like President Trump will depict us as living in a dangerous area.\u201d\n\nFalling crime stats aside, El Paso is struggling with a growing immigration crisis. The number of immigrant families apprehended by the Border Patrol\u2019s El Paso Sector has soared in recent years, from 562 in fiscal year 2014 to 8,609 in fiscal year 2017 and 12,312 last fiscal year. Over Christmas, hundreds of immigrants released from federal immigration custody were dropped off at downtown bus shelters, sending churches and activist groups scrambling to assist them.\n\nAdolpho Telles, chairman of El Paso County Republican Party, said he feels the area has become safer since federal authorities erected the border fence in El Paso, limiting the streams of migrants who were crossing into the community.\n\nShortly after Trump\u2019s State of the Union, Telles received a request from the president\u2019s campaign for 150 volunteers to help at the rally, which he secured within two days, he said.\n\nIn McAllen last month, more than 100 Trump supporters lined a busy street near the airport in a well-organized rally to welcome the president. Telles said he doesn't expect a similar pro-Trump rally to materialize in El Paso, but he hoped both sides of the divisive debate could respect the other on Monday.\n\n\u201cI hope El Paso gives the president an extremely El Paso-friendly welcome,\u201d he said. \u201cI hope the president spends more time talking about unity in the nation and I hope we as a city could show that unity.\u201d\n\nSilvestre Reyes, a former Border Patrol sector chief here and ex-Congressman representing El Paso, said he was taken aback by the inaccuracy of Trump's recent comments. Illegal crossings into El Paso dropped from around 10,000 a day to less than 200 after he launched Operation Hold the Line -- more than a decade before the security fence went up.\n\nHe said he found Trump's comments -- followed by his decision to hold a campaign rally here -- distasteful.\n\n\"\u202aIt\u2019s very frustrating to have someone at that level who could misrepresent what actually goes on\" Reyes said.\n\nNess-Garcia, the march organizer, said she and others are dismayed that El Paso has been the site for controversial federal immigration practices. The Trump administration launched a pilot program here for family separations before expanding the program, she said. The policy drew fierce criticism and was ultimately dropped, though it remains unclear how many children were separated from the families and are still being separated.\n\nAnd the Tornillo faciltiy, a tent city housing migrant youth that also later closed under withering criticism, was operated nearby.\n\n\"El Paso, unfortunately, has been the testing grounds for some of the most inhumane policies of this administration,\" Ness-Garcia said. \"Yes, there's a lot of anger, but there's allo a lot of positivity. That's what we want to focus on: being peaceful and passionate.\"\n\nPerception is important in a place like El Paso, the nation's 10th largest exporter and whose retail stores rely heavily on shoppers crossing over from Mexico.\n\nLocal leaders are continuously fighting negative portrayals of El Paso, not just arising from Washington but from Hollywood, as well, said Jon Barela, chief executive of the Borderplex Alliance, an El-Paso-based economic development group.\n\nMovies, like Oscar-nominated \"Sicario,\" have portrayed El Paso as struggling to rebuff the carnage spilling over from cartel violence across the border in Ciudad Juarez, Mexico.\n\nTrump's comments added to that perception.\n\n\u201cThat\u2019s the image we have to fight every single day, and it\u2019s a false image of our area,\" Barela said.\n\nAt Lucy\u2019s Coffee Shop near downtown El Paso, diners munched on breakfast burritos and debated which of the two rallies they\u2019d rather attend: Trump\u2019s or O\u2019Rourke\u2019s.\n\nJessica Kludt, 34, an attorney, said she was definitely going to the latter.\n\n\u201cI\u2019m hoping the Beto rally will be full and the Trump rally is empty,\u201d she said. \u201cThat\u2019s my hope.\u201d\n\nFollow Jervis on Twitter: @MrRJervis.\n\nContributing: Alan Gomez and Associated Press\n\nRead or Share this story: https://www.usatoday.com/story/news/2019/02/11/trump-el-paso-rally/2834896002/",
    "source_url": "www.usatoday.com",
    "bias_text": "center",
    "ID": "Ts01gNxyULu0pXBT"
}