{
    "topic": "taxes",
    "source": "USA TODAY",
    "bias": 1,
    "url": "https://www.usatoday.com/story/money/2019/02/20/tax-refund-2019-unexpected-irs-bills-burden-some-americans-budgets/2909854002/",
    "title": "Some Americans face a costly surprise this tax season: tiny refunds or bigger bills",
    "date": "2019-02-20",
    "authors": "Janna Herron",
    "content": "CLOSE It \u2019 s tax time again . In your rush to get your taxes done , don \u2019 t make these six mistakes . Josmar Taveras , \u2588\u2588\u2588\nFor some Americans , this tax season has come with an unwelcome surprise : either a smaller-than-expected refund or , even worse , a jarring bill from Uncle Sam .\nMost got their tax savings in their paychecks during the year , but the loss of a sizable refund is hitting their finances now . Some are getting refunds that are half their normal size , while others are thousands of dollars in the hole for the first time .\nTo manage , they are readjusting their spending plans to align with a smaller refund . People who owe are pulling from savings , taking out a loan or signing up to pay off the IRS in installments . They plan to consult with tax pros so they can avoid another money disaster next year .\nStart the day smarter : Get \u2588\u2588\u2588 's Daily Briefing in your inbox\n`` We \u2019 re finding out that those with the biggest refund change are those that didn \u2019 t do tax planning last year , \u201d said Lynn Ebel , director of The Tax Institute at H & R Block .\nSo far , according to IRS statistics , the average refund is down 8.7 percent from this time last year after the biggest tax law changes in decades . The share of returns getting a refund is also slightly lower than a year ago . The IRS does n't offer figures about what people owe .\nCan a watch save your life ? : 'It saved my life ' : Apple Watch , Fitbit are notifying users of medical emergencies\nWho wants a foldable phone ? : Forget 5G and foldable . We just want it to last all day : What you want from new smartphone\nCLOSE Tax filing season is here , and the overhaul of tax laws means some potentially big changes for your budget . Did you get refund , or do you owe the IRS ? Josmar Taveras , \u2588\u2588\u2588\nAmericans love their tax refunds \u2013 even if they give the federal government interest-free loans for the year by having too much withheld in each of their paychecks . Many prefer the money returned to them as a big check in the spring . The forced savings helps them preserve a predictable windfall , one they can \u2019 t dip into during the year .\nPast taxpayer surveys show they use that money to reduce debt , pad savings or pay for a vacation or other large purchases . Overall , about three-fourths of taxpayers get a refund , which last year averaged just under $ 3,000 .\nJennifer and Daniel Yuen planned to use their refund to support their oldest daughter , who moved to Washington , D.C. , to train with the Washington Ballet . The couple pay for her tuition and rent .\nLast year , they got almost $ 800 back . This year , they owe more than $ 5,000 \u2013 a major burden for the Chicago couple .\n\u201c We \u2019 re strapped , \u201d said Jennifer , a special-education teacher . `` That 's three to four months of my daughter \u2019 s rent or half of her tuition . \u201d\nInstead , they are considering a payment plan with the IRS because they ca n't afford to write such a big check . Those extra monthly payments will dent other plans they had for this year , too .\n\u201c This will put off the car that was supposed to replace our 11-year-old one , '' Jennifer said .\nJennifer says the elimination of the unreimbursed employee expenses deduction hit their taxes hard . Both she and her husband , who is a stagehand , often spend their own money on job supplies \u2013 all of which used to be tax-deductible .\nThe Yuens fit the profile of those taxpayers most at risk for smaller refunds or owing the government , Ebel said .\nHomeowners in high tax states , employees with a lot of unreimbursed expenses and people who itemize with no dependents all could experience an unpleasant tax season .\nKathleen Trisdale expected to owe something this year . \u201c Maybe a few hundred dollars , \u201d said the resident of California , a state with high taxes .\n\u201c I \u2019 m a low-income person so I didn \u2019 t think I would be affected this much. \u201d Kathleen Trisdale , a taxpayer in California\nInstead , she owes more than $ 2,000 , a hardship for the disabled veteran , who depends on her military pension and Social Security for income .\n\u201c I actually had to take out a signature loan from my credit union to pay my taxes and had to increase my monthly deductions by $ 300 to make sure I 'm not hit hard next year , \u201d Trisdale said . \u201c So not only am I hit with this tax hike , I am now more in debt and I have less income at my disposal each month . \u201d\nShe \u2019 s not entirely sure why her taxes ended up this way . She noticed that she couldn \u2019 t deduct her college tuition and other school expenses . She \u2019 s pursuing a four-year degree in environmental science and management .\nTrisdale , 54 , also couldn \u2019 t write off the interest she paid on her mortgage because she took the standard deduction .\nShe plans to see a tax professional for help , \u201c which will cost me even more , \u201d she said . `` I \u2019 m a low-income person so I didn \u2019 t think I would be affected this much . \u201d\nIn large part , those who owe money to the federal government are n't necessarily paying more in taxes after the major changes to the tax law . In fact , four in five taxpayers are estimated to get a tax cut , according to the Tax Policy Center .\nBut if you didn \u2019 t change your paycheck withholdings \u2013 which most taxpayers did n't do \u2013 your tax savings were doled out during the year in each paycheck , reducing or eliminating your refund .\n\u201c When we compared withholdings of people on file , September 2017 versus September 2018 , it was largely unchanged , \u201d said Pete Isberg , head of government affairs at ADP , a payroll and HR services provider . \u201c Generally , few employees changed their withholdings . \u201d\nWorkers may have not noticed any changes to their paychecks either , Isberg said , because their 2018 paychecks not only included the tax law changes , but also any changes to their other benefits , such as healthcare premiums .\n\u201c So , net-net they may not have seen an increase , \u201d he said .\nDiana Hansen did n't want to take any chances on her refund that she planned to use for a trip to Bermuda this year to celebrate her 25th anniversary with her husband . Aside from her typical withholdings , Hansen \u2013 an executive administrative assistant \u2013 had $ 100 more taken out of each paycheck .\nIt still was n't enough . The couple \u2013 who normally gets $ 1,000 to $ 3,000 back \u2013 owes $ 4,200 in federal taxes .\nDiana thinks the $ 10,000 cap on the state and local tax deduction is largely to blame . Fortunately , the couple has enough in savings to pay in one lump sum .\n\u201c You get your savings to a certain level that you have a buffer , and then this happens. \u201d Diana Hansen , a taxpayer in New Jersey\n\u201c But it kills me , '' she said . `` You get your savings to a certain level that you have a buffer , and then this happens . ''\nShe and her husband will still go to Bermuda and , in the meantime , are adjusting their withholdings for next year . So far , she 's taking out an additional $ 150 from her paycheck , but could do more if needed .\n\u201c Our taxes are sitting right here , \u201d she said . \u201c I haven \u2019 t signed them and won \u2019 t until the very end . \u201d\nIn some ways , Stephanie Harris is one of the luckier ones . The 53-year-old actuary in Pittsburgh is still getting a refund , but it \u2019 s about half of what it usually is . Even so , she is one of the five percent of filers that the Tax Policy Center estimated would end up paying more in federal taxes following the changes to the tax law .\n\u201c In the past five years , my effective tax rate has been as low as 6.13 percent and as a high as 8.43 percent , \u201d she said . \u201c This year , my effective tax rate was 9.38 percent , the highest it \u2019 s ever been . \u201d\nTax tools : These online tools can help you navigate your federal returns\nWatch for tax errors:10 common filing mistakes to avoid this year\nHarris ended up taking the standard deduction of $ 24,000 for married couples filing jointly . But the elimination of the dependent exemption \u2013 she has two children she can claim \u2013 and the $ 10,000 cap on the state and local tax deduction did n't help her refund .\n`` This means we have to take more out of savings toward paying the rest of this year \u2019 s tuition ( for her child ) , '' she said . `` More than we counted on . ''",
    "content_original": "CLOSE It\u2019s tax time again. In your rush to get your taxes done, don\u2019t make these six mistakes. Josmar Taveras, USA TODAY\n\nFor some Americans, this tax season has come with an unwelcome surprise: either a smaller-than-expected refund or, even worse, a jarring bill from Uncle Sam.\n\nMost got their tax savings in their paychecks during the year, but the loss of a sizable refund is hitting their finances now. Some are getting refunds that are half their normal size, while others are thousands of dollars in the hole for the first time.\n\nTo manage, they are readjusting their spending plans to align with a smaller refund. People who owe are pulling from savings, taking out a loan or signing up to pay off the IRS in installments. They plan to consult with tax pros so they can avoid another money disaster next year.\n\nStart the day smarter: Get USA TODAY's Daily Briefing in your inbox\n\n\"We\u2019re finding out that those with the biggest refund change are those that didn\u2019t do tax planning last year,\u201d said Lynn Ebel, director of The Tax Institute at H&R Block.\n\nSo far, according to IRS statistics, the average refund is down 8.7 percent from this time last year after the biggest tax law changes in decades. The share of returns getting a refund is also slightly lower than a year ago. The IRS doesn't offer figures about what people owe.\n\nCan a watch save your life?: 'It saved my life': Apple Watch, Fitbit are notifying users of medical emergencies\n\nWho wants a foldable phone?: Forget 5G and foldable. We just want it to last all day: What you want from new smartphone\n\nCLOSE Tax filing season is here, and the overhaul of tax laws means some potentially big changes for your budget. Did you get refund, or do you owe the IRS? Josmar Taveras, USA TODAY\n\nThat's my refund?\n\nAmericans love their tax refunds \u2013 even if they give the federal government interest-free loans for the year by having too much withheld in each of their paychecks. Many prefer the money returned to them as a big check in the spring. The forced savings helps them preserve a predictable windfall, one they can\u2019t dip into during the year.\n\nPast taxpayer surveys show they use that money to reduce debt, pad savings or pay for a vacation or other large purchases. Overall, about three-fourths of taxpayers get a refund, which last year averaged just under $3,000.\n\nJennifer and Daniel Yuen planned to use their refund to support their oldest daughter, who moved to Washington, D.C., to train with the Washington Ballet. The couple pay for her tuition and rent.\n\nJennifer Yuen poses with her husband, Daniel. (Photo: Jennifer Yuen)\n\nLast year, they got almost $800 back. This year, they owe more than $5,000 \u2013 a major burden for the Chicago couple.\n\n\u201cWe\u2019re strapped,\u201d said Jennifer, a special-education teacher. \"That's three to four months of my daughter\u2019s rent or half of her tuition.\u201d\n\nInstead, they are considering a payment plan with the IRS because they can't afford to write such a big check. Those extra monthly payments will dent other plans they had for this year, too.\n\n\u201cThis will put off the car that was supposed to replace our 11-year-old one,\" Jennifer said.\n\nWho owes taxes?\n\nJennifer says the elimination of the unreimbursed employee expenses deduction hit their taxes hard. Both she and her husband, who is a stagehand, often spend their own money on job supplies \u2013 all of which used to be tax-deductible.\n\n\u201cThat's what really killed us,\" she said.\n\nThe Yuens fit the profile of those taxpayers most at risk for smaller refunds or owing the government, Ebel said.\n\nHomeowners in high tax states, employees with a lot of unreimbursed expenses and people who itemize with no dependents all could experience an unpleasant tax season.\n\nKathleen Trisdale expected to owe something this year. \u201cMaybe a few hundred dollars,\u201d said the resident of California, a state with high taxes.\n\n\u201cI\u2019m a low-income person so I didn\u2019t think I would be affected this much.\u201d Kathleen Trisdale, a taxpayer in California\n\nInstead, she owes more than $2,000, a hardship for the disabled veteran, who depends on her military pension and Social Security for income.\n\n\u201cI actually had to take out a signature loan from my credit union to pay my taxes and had to increase my monthly deductions by $300 to make sure I'm not hit hard next year,\u201d Trisdale said. \u201cSo not only am I hit with this tax hike, I am now more in debt and I have less income at my disposal each month.\u201d\n\nShe\u2019s not entirely sure why her taxes ended up this way. She noticed that she couldn\u2019t deduct her college tuition and other school expenses. She\u2019s pursuing a four-year degree in environmental science and management.\n\n(Photo: Getty Images)\n\nTrisdale, 54, also couldn\u2019t write off the interest she paid on her mortgage because she took the standard deduction.\n\nShe plans to see a tax professional for help, \u201cwhich will cost me even more,\u201d she said. \"I\u2019m a low-income person so I didn\u2019t think I would be affected this much.\u201d\n\nWithholding math\n\nIn large part, those who owe money to the federal government aren't necessarily paying more in taxes after the major changes to the tax law. In fact, four in five taxpayers are estimated to get a tax cut, according to the Tax Policy Center.\n\nBut if you didn\u2019t change your paycheck withholdings \u2013 which most taxpayers didn't do \u2013 your tax savings were doled out during the year in each paycheck, reducing or eliminating your refund.\n\n\u201cWhen we compared withholdings of people on file, September 2017 versus September 2018, it was largely unchanged,\u201d said Pete Isberg, head of government affairs at ADP, a payroll and HR services provider. \u201cGenerally, few employees changed their withholdings.\u201d\n\nStephanie Harris poses with her husband, Michael. (Photo: Stephanie Harris)\n\nWorkers may have not noticed any changes to their paychecks either, Isberg said, because their 2018 paychecks not only included the tax law changes, but also any changes to their other benefits, such as healthcare premiums.\n\n\u201cSo, net-net they may not have seen an increase,\u201d he said.\n\nAdjusted withholdings, but not enough\n\nDiana Hansen didn't want to take any chances on her refund that she planned to use for a trip to Bermuda this year to celebrate her 25th anniversary with her husband. Aside from her typical withholdings, Hansen \u2013 an executive administrative assistant \u2013 had $100 more taken out of each paycheck.\n\nIt still wasn't enough. The couple \u2013 who normally gets $1,000 to $3,000 back \u2013 owes $4,200 in federal taxes.\n\nDiana thinks the $10,000 cap on the state and local tax deduction is largely to blame. Fortunately, the couple has enough in savings to pay in one lump sum.\n\n\u201cYou get your savings to a certain level that you have a buffer, and then this happens.\u201d Diana Hansen, a taxpayer in New Jersey\n\n\u201cBut it kills me,\" she said. \"You get your savings to a certain level that you have a buffer, and then this happens.\"\n\nShe and her husband will still go to Bermuda and, in the meantime, are adjusting their withholdings for next year. So far, she's taking out an additional $150 from her paycheck, but could do more if needed.\n\n\u201cOur taxes are sitting right here,\u201d she said. \u201cI haven\u2019t signed them and won\u2019t until the very end.\u201d\n\nActually paying more in taxes\n\nIn some ways, Stephanie Harris is one of the luckier ones. The 53-year-old actuary in Pittsburgh is still getting a refund, but it\u2019s about half of what it usually is. Even so, she is one of the five percent of filers that the Tax Policy Center estimated would end up paying more in federal taxes following the changes to the tax law.\n\n\u201cIn the past five years, my effective tax rate has been as low as 6.13 percent and as a high as 8.43 percent,\u201d she said. \u201cThis year, my effective tax rate was 9.38 percent, the highest it\u2019s ever been.\u201d\n\nTax tools: These online tools can help you navigate your federal returns\n\nWatch for tax errors:10 common filing mistakes to avoid this year\n\nHarris ended up taking the standard deduction of $24,000 for married couples filing jointly. But the elimination of the dependent exemption \u2013 she has two children she can claim \u2013 and the $10,000 cap on the state and local tax deduction didn't help her refund.\n\n\"This means we have to take more out of savings toward paying the rest of this year\u2019s tuition (for her child),\" she said. \"More than we counted on.\"\n\nFollow USA TODAY reporter Janna Herron on Twitter @JannaHerron or email her at JHerron@usatoday.com.\n\nRead or Share this story: https://www.usatoday.com/story/money/2019/02/20/tax-refund-2019-unexpected-irs-bills-burden-some-americans-budgets/2909854002/",
    "source_url": "www.usatoday.com",
    "bias_text": "center",
    "ID": "nzUNCXldqWuETrwc"
}